{
     "prescriptionId": 12299,
                "prescriptionDate": "08/21/2017",
                "prescripReasonCodeCncptId": null,
                "prescribedBy": null,
                "effectiveDate": "08/21/2017",
                "courseCompletedCodeCncptId": null,
                "frequency": "3X",
                "routeCodeCncptId": 1279134,
                "specialDirection": null,
                "durationUnitCodeCncptId": 7,
                "genericDrugName": null,
                "dose": 500,
                "doseUnitCodeCncptId": 493417,
                "startDate": "08/21/2017",
                "doseFormCodeCncptId": null,
                "drugDescription": null,
                "orderDurationUntCdCncptId": null,
                "isDeletedInd": "N",
                "lockSeqNum": 0,
                "modifiedBy": null,
                "modifiedOn": null,
                "createdBy": "ESTI_DEMO",
                "createdOn": "08/21/2017",
                "catalogueItemId": 112,
                "subjectId": 2468043,
                "actualEndDate": null,
                "discountinuedResnCdCncptId": null,
                "discontinuedDate": null,
                "discontinuedBy": null,
                "reasnDrgNtStppdCdCncptId": null,
                "nonhumanSubjectId": null,
                "discontinuedByProviderOther": null,
                "prescribedByProviderOther": "Other",
                "otherMedInd": "N",
                "prevSubjectId": null,
                "prescriptionReasonOther": null,
                "reasonDrugStoppdCdCncptId": null,
                "effectiveDateEstimatedInd": "N",
                "duration": 7,
                "orderDuration": null,
                "catalogueItemIdL2": 45,
                "treatmentDuration": null,
                "treatmentDurUnitCncptId": null,
                "investigationId": 81111,
                "encounterId": null,
                "drugProtocolId": null
}